{
  "$schema": "../schemas/release_manifest.schema.json",
  "manifest_schema_version": "4.0.0",
  "name": "sha256-research-framework",
  "version": "5.1.0",
  "repository": "https://github.com/timfromhcs/sha256-research-framework",
  "target_branch": "main",
  "release_tag": "v5.1.0",
  "source_commit_sha": "2e04195d6012fa68441817407f66f67ba51c9e0a",
  "commit_sha": "2e04195d6012fa68441817407f66f67ba51c9e0a",
  "release_commit_sha": null,
  "release_commit_semantics": "The repository release manifest records source_commit_sha (the verified source commit from which all tests, artifacts, and benchmarks were produced prior to release packaging). release_commit_sha is null within the committed tree to eliminate self-referential hash dependency, and is populated in post-release distribution artifacts.",
  "timestamp": "2026-10-20T04:00:38.619705+00:00",
  "certification": {
    "status": "OFFICIALLY_VERIFIED",
    "anti_cheating_gate_passed": true,
    "conflation_prevention_verified": true,
    "claims": {
      "full_sha256_collision_claimed": false,
      "full_sha256_status": "UNBROKEN_COMPUTATIONALLY_SECURE",
      "scientific_integrity_statement": "No standard full SHA-256 collision or preimage demonstrated. Full preimage resistance is 2^256 compression-function evaluations (~1.16e77), a physical bound rather than an implementation gap.",
      "reduced_round_preimages_verified": [
        {
          "rounds": 18,
          "solver": "CryptoMiniSat 5.8.0",
          "encoding": "xor + carry-save",
          "runtime_seconds": 13.2,
          "classification": "ReducedRoundPreimage",
          "verified_by": "Independent Verifier Segregated Engine"
        },
        {
          "rounds": 19,
          "solver": "Context Shaping (submask family)",
          "encoding": "algebraic context-shaping backward chain",
          "runtime_seconds": 0.3,
          "classification": "ReducedRoundPreimage",
          "verified_by": "Independent Verifier Segregated Engine"
        }
      ],
      "deepest_solved_preimage_rounds": 19,
      "deepest_verified_external_witness_rounds": 20,
      "unresolved_rounds_note": "Round 20 solved preimages have not been generated by this framework; 20-round witnesses are verified from published literature. Round 21 remains arithmetically obstructed."
    }
  },
  "remote_ci_workflow_runs": [
    {
      "name": "Build (Windows MSVC)",
      "run_id": 38137961450,
      "status": "completed",
      "conclusion": "success",
      "url": "https://github.com/timfromhcs/sha256-research-framework/actions/runs/38137961450"
    },
    {
      "name": "Tests (Windows)",
      "run_id": 38137961445,
      "status": "completed",
      "conclusion": "success",
      "url": "https://github.com/timfromhcs/sha256-research-framework/actions/runs/38137961445"
    },
    {
      "name": "Independent Verifier & Adversarial Gate",
      "run_id": 38137961434,
      "status": "completed",
      "conclusion": "success",
      "url": "https://github.com/timfromhcs/sha256-research-framework/actions/runs/38137961434"
    },
    {
      "name": "Evidence Integrity & Anti-Tamper",
      "run_id": 38137961440,
      "status": "completed",
      "conclusion": "success",
      "url": "https://github.com/timfromhcs/sha256-research-framework/actions/runs/38137961440"
    },
    {
      "name": "Security & Anti-Cheating Controls",
      "run_id": 38137961463,
      "status": "completed",
      "conclusion": "success",
      "url": "https://github.com/timfromhcs/sha256-research-framework/actions/runs/38137961463"
    },
    {
      "name": "Documentation & Reproducibility Check",
      "run_id": 38137961465,
      "status": "completed",
      "conclusion": "success",
      "url": "https://github.com/timfromhcs/sha256-research-framework/actions/runs/38137961465"
    }
  ],
  "test_suites": {
    "framework_tests": {
      "passed": 39,
      "total": 39,
      "status": "PASSED"
    },
    "adversarial_tests": {
      "passed": 11,
      "total": 11,
      "status": "PASSED"
    },
    "ctest_suite": {
      "targets_passed": 17,
      "targets_total": 17,
      "status": "PASSED"
    },
    "python_platform_tests": {
      "passed": 82,
      "total": 82,
      "status": "PASSED"
    },
    "reproducibility_evidence_test": {
      "status": "PASSED",
      "clean_exit_code": 0
    }
  },
  "benchmarks": {
    "cpu_scalar": {
      "throughput_mhash_s": 1.84,
      "description": "Single-thread FIPS 180-4 reference implementation"
    },
    "cpu_optimized_1t": {
      "throughput_mhash_s": 3.43,
      "description": "Single-thread unrolled round loops"
    },
    "cpu_optimized_16t": {
      "throughput_mhash_s": 27.18,
      "description": "Multithreaded unrolled compression execution (16 threads)"
    },
    "context_shaping_search": {
      "throughput_swept_s": 120000000.0,
      "description": "Multithreaded batched context-shaping search (16 threads, batch 16, width 2^30)"
    },
    "vulkan_compute": {
      "throughput_mhash_s": 0.72,
      "description": "Vulkan 1.4 compute dispatch pipeline (AMD Radeon 680M)"
    },
    "sat_cnf_encoding": {
      "rate_problems_s": 79.0,
      "description": "Tseitin round transform for 16-round SHA-256"
    },
    "deepest_verified_preimage_rounds": 19
  },
  "solvers_detected": {
    "cadical": "3.0.1 (WSL2 / native)",
    "kissat": "4.0.4 (WSL2)",
    "cryptominisat": "5.8.0 (WSL2)",
    "minisat": "2.2.1 (WSL2)",
    "z3": "4.8.12 (WSL2) / 4.16.0 (Python)"
  },
  "root_evidence_hash": "ee659c6b98551fd3dfe7a697633abf0bacd553458fce49aee1450e59936d2afe"
}
